PassengerId,Survived,Pclass,Name,Sex,Age,SibSp,Parch,Ticket,Fare,Cabin,Embarked
407,0,3,Mr. Hans Martin Monsen Birkeland,male,51,0,0,347064,7.75,,S
408,1,2,Miss. Ida Lefebre,male,3,1,1,29106,18.75,,S
409,0,3,Mr. Todor Sdycoff,male,21,0,0,312992,7.775,,S
410,0,3,Mr. Henry Hart,female,,3,1,4133,25.4667,,S
411,0,3,Miss. Daisy E Minahan,male,,0,0,349222,7.8958,,S
412,0,3,Mr. Alfred Fleming Cunningham,male,,0,0,394140,6.8583,,Q
413,1,1,Mr. Johan Julian Sundman,female,33,1,0,19928,90,C78,Q
414,0,2,Mrs. Thomas (Annie Louise Rowley) Meek,male,,0,0,239853,0,,S
415,1,3,Mrs. James Vivian (Lulu Thorne Christian) Drew,male,44,0,0,STON/O 2. 3101269,7.925,,S
416,0,3,Miss. Lyyli Karoliina Silven,female,,0,0,343095,8.05,,S
417,1,2,Mr. William John Matthews,female,34,1,1,28220,32.5,,S
418,1,2,Miss. Catharina Van Impe,female,18,0,2,250652,13,,S
419,0,2,Mr. David Charters,male,30,0,0,28228,13,,S
420,0,3,Mr. Leo Zimmerman,female,10,0,2,345773,24.15,,S
421,0,3,Mrs. Ernst Gilbert (Anna Sigrid Maria Brogren) Danbom,male,,0,0,349254,7.8958,,C
422,0,3,Mr. Viktor Richard Rosblom,male,21,0,0,A/5. 13032,7.7333,,Q
423,0,3,Mr. Phillippe Wiseman,male,29,0,0,315082,7.875,,S
424,0,3,Mrs. Charles V (Ada Maria Winfield) Clarke,female,28,1,1,347080,14.4,,S
425,0,3,Miss. Kate Florence Phillips,male,18,1,1,370129,20.2125,,S
426,0,3,Mr. James Flynn,male,,0,0,A/4. 34244,7.25,,S
427,1,2,Mr. Berk (Berk Trembisky) Pickard,female,28,1,0,2003,26,,S
428,1,2,Mr. Mauritz Hakan Bjornstrom-Steffansson,female,19,0,0,250655,26,,S
429,0,3,Mrs. Percival (Florence Kate White) Thorneycroft,male,,0,0,364851,7.75,,Q
430,1,3,Mrs. Charles Alexander (Alice Adelaide Slow) Louch,male,32,0,0,SOTON/O.Q. 392078,8.05,E10,S
431,1,1,Mr. Nikolai Erland Kallio,male,28,0,0,110564,26.55,C52,S
432,1,3,Mr. William Baird Silvey,female,,1,0,376564,16.1,,S
433,1,2,Miss. Lucile Polk Carter,female,42,1,0,SC/AH 3085,26,,S
434,0,3,Miss. Doolina Margaret Ford,male,17,0,0,STON/O 2. 3101274,7.125,,S
435,0,1,Mrs. Sidney (Emily Hocking) Richards,male,50,1,0,13507,55.9,E44,S
436,1,1,Mr. Mark Fortune,female,14,1,2,113760,120,B96 B98,S
437,0,3,Mr. Johan Henrik Johannesson Kvillner,female,21,2,2,W./C. 6608,34.375,,S
438,1,2,Mrs. Benjamin (Esther Ada Bloomfield) Hart,female,24,2,3,29106,18.75,,S
439,0,1,Mr. Leon Hampe,male,64,1,4,19950,263,C23 C25 C27,S
440,0,2,Mr. Johan Emil Petterson,male,31,0,0,C.A. 18723,10.5,,S
441,1,2,Ms. Encarnacion Reynaldo,female,45,1,1,F.C.C. 13529,26.25,,S
442,0,3,Mr. Bernt Johannesen-Bratthammer,male,20,0,0,345769,9.5,,S
443,0,3,Master. Washington Dodge,male,25,1,0,347076,7.775,,S
444,1,2,Miss. Madeleine Violet Mellinger,female,28,0,0,230434,13,,S
445,1,3,Mr. Frederic Kimber Seward,male,,0,0,65306,8.1125,,S
446,1,1,Miss. Marie Catherine Baclini,male,4,0,2,33638,81.8583,A34,S
447,1,2,Major. Arthur Godfrey Peuchen,female,13,0,1,250644,19.5,,S
448,1,1,Mr. Edwy Arthur West,male,34,0,0,113794,26.55,,S
449,1,3,Mr. Ingvald Olai Olsen Hagland,female,5,2,1,2666,19.2583,,C
450,1,1,Mr. Benjamin Laventall Foreman,male,52,0,0,113786,30.5,C104,S
451,0,2,Mr. Samuel L Goldenberg,male,36,1,2,C.A. 34651,27.75,,S
452,0,3,Mr. Joseph Peduzzi,male,,1,0,65303,19.9667,,S
453,0,1,Mr. Ivan Jalsevac,male,30,0,0,113051,27.75,C111,C
454,1,1,Mr. Francis Davis Millet,male,49,1,0,17453,89.1042,C92,C
455,0,3,Mrs. Frederick R (Marion) Kenyon,male,,0,0,A/5 2817,8.05,,S
456,1,3,Miss. Ellen Toomey,male,29,0,0,349240,7.8958,,C
457,0,1,Mr. Maurice O'Connor,male,65,0,0,13509,26.55,E38,S
458,1,1,Mr. Harry Anderson,female,,1,0,17464,51.8625,D21,S
459,1,2,Mr. William Morley,female,50,0,0,F.C.C. 13531,10.5,,S
460,0,3,Mr. Arthur H Gee,male,,0,0,371060,7.75,,Q
461,1,1,Mr. Jacob Christian Milling,male,48,0,0,19952,26.55,E12,S
462,0,3,Mr. Simon Maisner,male,34,0,0,364506,8.05,,S
463,0,1,Mr. Manuel Estanslas Goncalves,male,47,0,0,111320,38.5,E63,S
464,0,2,Mr. William Campbell,male,48,0,0,234360,13,,S
465,0,3,Mr. John Montgomery Smart,male,,0,0,A/S 2816,8.05,,S
466,0,3,Mr. James Scanlan,male,38,0,0,SOTON/O.Q. 3101306,7.05,,S
467,0,2,Miss. Helene Barbara Baclini,male,,0,0,239853,0,,S
468,0,1,Mr. Arthur Keefe,male,56,0,0,113792,26.55,,S
469,0,3,Mr. Luka Cacic,male,,0,0,36209,7.725,,Q
470,1,3,Mrs. Edwy Arthur (Ada Mary Worth) West,female,0.75,2,1,2666,19.2583,,C
471,0,3,Mrs. Amin S (Marie Marthe Thuillard) Jerwan,male,,0,0,323592,7.25,,S
472,0,3,Miss. Ida Sofia Strandberg,male,38,0,0,315089,8.6625,,S
473,1,2,Mr. George Quincy Clifford,female,33,1,2,C.A. 34651,27.75,,S
474,1,2,Mr. Peter Henry Renouf,female,23,0,0,SC/AH Basle 541,13.7917,D,C
475,0,3,Mr. Lewis Richard Braund,female,22,0,0,7553,9.8375,,S
476,0,1,Mr. Nils August Karlsson,male,,0,0,110465,52,A14,S
477,0,2,Miss. Hildur E Hirvonen,male,34,1,0,31027,21,,S
478,0,3,Master. Harold Victor Goodwin,male,29,1,0,3460,7.0458,,S
479,0,3,Mr. Anthony Wood Frost,male,22,0,0,350060,7.5208,,S
480,1,3,Mr. Richard Henry Rouse,female,2,0,1,3101298,12.2875,,S
481,0,3,Mrs. (Hedwig) Turkula,male,9,5,2,CA 2144,46.9,,S
482,0,2,Mr. Dickinson H Bishop,male,,0,0,239854,0,,S
483,0,3,Miss. Jeannie Lefebre,male,50,0,0,A/5 3594,8.05,,S
484,1,3,Mrs. Frederick Maxfield (Jane Anne Forby) Hoyt,female,63,0,0,4134,9.5875,,S
485,1,1,Mr. Edward Austin Kent,male,25,1,0,11967,91.0792,B49,C
486,0,3,Mr. Francis William Somerton,female,,3,1,4133,25.4667,,S
487,1,1,Master. Eden Leslie Coutts,female,35,1,0,19943,90,C93,S
488,0,1,Mr. Konrad Mathias Reiersen Hagland,male,58,0,0,11771,29.7,B37,C
489,0,3,Mr. Einar Windelov,male,30,0,0,A.5. 18509,8.05,,S
490,1,3,Mr. Harry Markland Molson,male,9,1,1,C.A. 37671,15.9,,S
491,0,3,Mr. Ramon Artagaveytia,male,,1,0,65304,19.9667,,S
492,0,3,Mr. Edward Roland Stanley,male,21,0,0,SOTON/OQ 3101317,7.25,,S
493,0,1,Mr. Gerious Yousseff,male,55,0,0,113787,30.5,C30,S
494,0,1,Miss. Elizabeth Mussey Eustis,male,71,0,0,PC 17609,49.5042,,C
495,0,3,Mr. Frederick William Shellard,male,21,0,0,A/4 45380,8.05,,S
496,0,3,Mrs. Hudson J C (Bessie Waldo Daniels) Allison,male,,0,0,2627,14.4583,,C
497,1,1,Mr. Olof Svensson,female,54,1,0,36947,78.2667,D20,C
498,0,3,Mr. Petar Calic,male,,0,0,C.A. 6212,15.1,,S
499,0,1,Miss. Mary Canavan,female,25,1,2,113781,151.55,C22 C26,S
500,0,3,Miss. Bridget Mary O'Sullivan,male,24,0,0,350035,7.7958,,S
501,0,3,Miss. Kristina Sofia Laitinen,male,17,0,0,315086,8.6625,,S
502,0,3,Miss. Roberta Maioni,female,21,0,0,364846,7.75,,Q
503,0,3,Mr. Victor de Satode Penasco y Castellana,female,,0,0,330909,7.6292,,Q
504,0,3,Mrs. Frederick Charles (Jane Richards) Quick,female,37,0,0,4135,9.5875,,S
505,1,1,Mr. George Bradley,female,16,0,0,110152,86.5,B79,S
506,0,1,Mr. Henry Margido Olsen,male,18,1,0,PC 17758,108.9,C65,C
507,1,2,Mr. Fang Lang,female,33,0,2,26360,26,,S
508,1,1,Mr. Eugene Patrick Daly,male,,0,0,111427,26.55,,S
509,0,3,Mr. James Webber,male,28,0,0,C 4001,22.525,,S
510,1,3,Mr. James Robert McGough,male,26,0,0,1601,56.4958,,S
511,1,3,Mrs. Martin (Elizabeth L. Barrett) Rothschild,male,29,0,0,382651,7.75,,Q
512,0,3,Mr. Satio Coleff,male,,0,0,SOTON/OQ 3101316,8.05,,S
513,1,1,Mr. William Anderson Walker,male,36,0,0,PC 17473,26.2875,E25,S
514,1,1,Mrs. (Amelia Milley) Lemore,female,54,1,0,PC 17603,59.4,,C
515,0,3,Mr. Patrick Ryan,male,24,0,0,349209,7.4958,,S
516,0,1,Mrs. William A (Florence Agnes Hughes) Angle,male,47,0,0,36967,34.0208,D46,S
517,1,2,Mr. Stefo Pavlovic,female,34,0,0,C.A. 34260,10.5,F33,S
518,0,3,Miss. Anne Perreault,male,,0,0,371110,24.15,,Q
519,1,2,Mr. Janko Vovk,female,36,1,0,226875,26,,S
520,0,3,Mr. Sarkis Lahoud,male,32,0,0,349242,7.8958,,S
521,1,1,Mrs. Louis Albert (Ida Sophia Fischer) Hippach,female,30,0,0,12749,93.5,B73,S
522,0,3,Mr. Fared Kassem,male,22,0,0,349252,7.8958,,S
523,0,3,Mr. James Farrell,male,,0,0,2624,7.225,,C
524,1,1,Miss. Lucy Ridsdale,female,44,0,1,111361,57.9792,B18,C
525,0,3,Mr. John Farthing,male,,0,0,2700,7.2292,,C
526,0,3,Mr. Johan Werner Salonen,male,40.5,0,0,367232,7.75,,Q
527,1,2,Mr. Richard George Hocking,female,50,0,0,W./C. 14258,10.5,,S
528,0,1,Miss. Phyllis May Quick,male,,0,0,PC 17483,221.7792,C95,S
529,0,3,Mr. Nakli Toufik,male,39,0,0,3101296,7.925,,S
530,0,2,Mr. Joseph Jr Elias,male,23,2,1,29104,11.5,,S
531,1,2,Mrs. Catherine (Catherine Rizk) Peter,female,2,1,1,26360,26,,S
532,0,3,Miss. Marija Cacic,male,,0,0,2641,7.2292,,C
533,0,3,Miss. Eva Miriam Hart,male,17,1,1,2690,7.2292,,C
534,1,3,Major. Archibald Willingham Butt,female,,0,2,2668,22.3583,,C
535,0,3,Miss. Bertha LeRoy,female,30,0,0,315084,8.6625,,S
536,1,2,Mr. Samuel Beard Risien,female,7,0,2,F.C.C. 13529,26.25,,S
537,0,1,Miss. Hedwig Margaritha Frolicher,male,45,0,0,113050,26.55,B38,S
538,1,1,Miss. Harriet R Crosby,female,30,0,0,PC 17761,106.425,,C
539,0,3,Miss. Ingeborg Constanzia Andersson,male,,0,0,364498,14.5,,S
540,1,1,Miss. Sigrid Elisabeth Andersson,female,22,0,2,13568,49.5,B39,C
541,1,1,Mr. Edward Beane,female,36,0,2,WE/P 5735,71,B22,S
542,0,3,Mr. Walter Donald Douglas,female,9,4,2,347082,31.275,,S
543,0,3,Mr. Arthur Ernest Nicholson,female,11,4,2,347082,31.275,,S
544,1,2,Mrs. Edward (Ethel Clarke) Beane,male,32,1,0,2908,26,,S
545,0,1,Mr. Julian Padro y Manent,male,50,1,0,PC 17761,106.425,C86,C
546,0,1,Mr. Frank John Goldsmith,male,64,0,0,693,26,,S
547,1,2,Master. John Morgan Jr Davies,female,19,1,0,2908,26,,S
548,1,2,Mr. John Borland Jr Thayer,male,,0,0,SC/PARIS 2146,13.8625,,C
549,0,3,Mr. Percival James R Sharp,male,33,1,1,363291,20.525,,S
550,1,2,Mr. Timothy O'Brien,male,8,1,1,C.A. 33112,36.75,,S
551,1,1,Mr. Fahim Leeni,male,17,0,2,17421,110.8833,C70,C
552,0,2,Miss. Velin Ohman,male,27,0,0,244358,26,,S
553,0,3,Mr. George Wright,male,,0,0,330979,7.8292,,Q
554,1,3,Lady. (Lucille Christiana Sutherland)Duff Gordon,male,22,0,0,2620,7.225,,C
555,1,3,Mr. Victor Robbins,female,22,0,0,347085,7.775,,S
556,0,1,Mrs. Emil (Tillie Mandelbaum) Taussig,male,62,0,0,113807,26.55,,S
557,1,1,Mrs. Guillaume Joseph (Emma) de Messemaeker,female,48,1,0,11755,39.6,A16,C
558,0,1,Mr. Thomas Rowan Morrow,male,,0,0,PC 17757,227.525,,C
559,1,1,Mr. Husein Sivic,female,39,1,1,110413,79.65,E67,S
560,1,3,Mr. Robert Douglas Norman,female,36,1,0,345572,17.4,,S
561,0,3,Mr. John Simmons,male,,0,0,372622,7.75,,Q
562,0,3,Miss. (Marion Ogden) Meanwell,male,40,0,0,349251,7.8958,,S
563,0,2,Mr. Alfred J Davies,male,28,0,0,218629,13.5,,S
564,0,3,Mr. Ilia Stoytcheff,male,,0,0,SOTON/OQ 392082,8.05,,S
565,0,3,Mrs. Nils (Alma Cornelia Berglund) Palsson,female,,0,0,SOTON/O.Q. 392087,8.05,,S
566,0,3,Mr. Tannous Doharr,male,24,2,0,A/4 48871,24.15,,S
567,0,3,Mr. Carl Jonsson,male,19,0,0,349205,7.8958,,S
568,0,3,Mr. George Harris,female,29,0,4,349909,21.075,,S
569,0,3,Mrs. Edward Dale (Charlotte Lamson) Appleton,male,,0,0,2686,7.2292,,C
570,1,3,Mr. John Irwin Flynn,male,32,0,0,350417,7.8542,,S
571,1,2,Miss. Mary Kelly,male,62,0,0,S.W./PP 752,10.5,,S
572,1,1,Mr. Alfred George John Rush,female,53,2,0,11769,51.4792,C101,S
573,1,1,Mr. George Patchett,male,36,0,0,PC 17474,26.3875,E25,S
574,1,3,Miss. Ethel Garside,female,,0,0,14312,7.75,,Q
575,0,3,Mrs. William Baird (Alice Munger) Silvey,male,16,0,0,A/4. 20589,8.05,,S
576,0,3,Mrs. Joseph (Maria Elias) Caram,male,19,0,0,358585,14.5,,S
577,1,2,Mr. Eiriik Jussila,female,34,0,0,243880,13,,S
578,1,1,Miss. Julie Rachel Christy,female,39,1,0,13507,55.9,E44,S
579,0,3,Mrs. John Borland (Marian Longstreth Morris) Thayer,female,,1,0,2689,14.4583,,C
580,1,3,Mr. William James Downton,male,32,0,0,STON/O 2. 3101286,7.925,,S
581,1,2,Mr. John Hugo Ross,female,25,1,1,237789,30,,S
582,1,1,Mr. Uscher Paulner,female,39,1,1,17421,110.8833,C68,C
583,0,2,Miss. Ruth Taussig,male,54,0,0,28403,26,,S
584,0,1,Mr. John Denzil Jarvis,male,36,0,0,13049,40.125,A10,C
585,0,3,Mr. Maxmillian Frolicher-Stehli,male,,0,0,3411,8.7125,,C
586,1,1,Mr. Eliezer Gilinski,female,18,0,2,110413,79.65,E68,S
587,0,2,Mr. Joseph Murdlin,male,47,0,0,237565,15,,S
588,1,1,Mr. Matti Rintamaki,male,60,1,1,13567,79.2,B41,C
589,0,3,Mrs. Walter Bertram (Martha Eustis) Stephenson,male,22,0,0,14973,8.05,,S
590,0,3,Mr. William James Elsbury,male,,0,0,A./5. 3235,8.05,,S
591,0,3,Miss. Mary Bourke,male,35,0,0,STON/O 2. 3101273,7.125,,S
592,1,1,Mr. John Henry Chapman,female,52,1,0,36947,78.2667,D20,C
593,0,3,Mr. Jean Baptiste Van Impe,male,47,0,0,A/5 3902,7.25,,S
594,0,3,Miss. Jessie Wills Leitch,female,,0,2,364848,7.75,,Q
595,0,2,Mr. Alfred Johnson,male,37,1,0,SC/AH 29037,26,,S
596,0,3,Mr. Hanna Boulos,male,36,1,1,345773,24.15,,S
597,1,2,Sir. Cosmo Edmund Duff Gordon,female,,0,0,248727,33,,S
598,0,3,Mrs. Sidney Samuel (Amy Frances Christy) Jacobsohn,male,49,0,0,LINE,0,,S
599,0,3,Mr. Petco Slabenoff,male,,0,0,2664,7.225,,C
600,1,1,Mr. Charles H Harrington,male,49,1,0,PC 17485,56.9292,A20,C
601,1,2,Mr. Ernst William Torber,female,24,2,1,243847,27,,S
602,0,3,Mr. Harry Homer,male,,0,0,349214,7.8958,,S
603,0,1,Mr. Edvard Bengtsson Lindell,male,,0,0,113796,42.4,,S
604,0,3,Mr. Milan Karaic,male,44,0,0,364511,8.05,,S
605,1,1,Mr. Robert Williams Daniel,male,35,0,0,111426,26.55,,C
606,0,3,Mrs. Joseph (Juliette Marie Louise Lafargue) Laroche,male,36,1,0,349910,15.55,,S
607,0,3,Miss. Elizabeth W Shutes,male,30,0,0,349246,7.8958,,S
608,1,1,Mrs. Anders Johan (Alfrida Konstantia Brogren) Andersson,male,27,0,0,113804,30.5,,S
609,1,2,Mr. Jose Neto Jardin,female,22,1,2,SC/Paris 2123,41.5792,,C
610,1,1,Miss. Margaret Jane Murphy,female,40,0,0,PC 17582,153.4625,C125,S
611,0,3,Mr. John Horgan,female,39,1,5,347082,31.275,,S
612,0,3,Mr. William Alfred Brocklebank,male,,0,0,SOTON/O.Q. 3101305,7.05,,S
613,1,3,Miss. Alice Herman,female,,1,0,367230,15.5,,Q
614,0,3,Mr. Ernst Gilbert Danbom,male,,0,0,370377,7.75,,Q
615,0,3,Mrs. William Arthur (Cordelia K Stanlick) Lobb,male,35,0,0,364512,8.05,,S
616,1,2,Miss. Marion Louise Becker,female,24,1,2,220845,65,,S
617,0,3,Mr. Lawrence Gavey,male,34,1,1,347080,14.4,,S
618,0,3,Mr. Antoni Yasbeck,female,26,1,0,A/5. 3336,16.1,,S
619,1,2,Mr. Edwin Nelson Jr Kimball,female,4,2,1,230136,39,F4,S
620,0,2,Mr. Sahid Nakid,male,26,0,0,31028,10.5,,S
621,0,3,Mr. Henry Damsgaard Hansen,male,27,1,0,2659,14.4542,,C
622,1,1,Mr. David John Bowen,male,42,1,0,11753,52.5542,D19,S
623,1,3,Mr. Frederick Sutton,male,20,1,1,2653,15.7417,,C
624,0,3,Rev. Charles Leonard Kirkland,male,21,0,0,350029,7.8542,,S
625,0,3,Miss. Gretchen Fiske Longley,male,21,0,0,54636,16.1,,S
626,0,1,Mr. Guentcho Bostandyeff,male,61,0,0,36963,32.3208,D50,S
627,0,2,Mr. Patrick D O'Connell,male,57,0,0,219533,12.35,,Q
628,1,1,Mr. Algernon Henry Wilson Barkworth,female,21,0,0,13502,77.9583,D9,S
629,0,3,Mr. Johan Svensson Lundahl,male,26,0,0,349224,7.8958,,S
630,0,3,Dr. Max Stahelin-Maeglin,male,,0,0,334912,7.7333,,Q
631,1,1,Mr. William Henry Marsh Parr,male,80,0,0,27042,30,A23,S
632,0,3,Miss. Mabel Skoog,male,51,0,0,347743,7.0542,,S
633,1,1,Miss. Mary Davis,male,32,0,0,13214,30.5,B50,C
634,0,1,Mr. Antti Gustaf Leinonen,male,,0,0,112052,0,,S
635,0,3,Mr. Harvey Collyer,female,9,3,2,347088,27.9,,S
636,1,2,Mrs. Juha (Maria Emilia Ojala) Panula,female,28,0,0,237668,13,,S
637,0,3,Mr. Percival Thorneycroft,male,32,0,0,STON/O 2. 3101292,7.925,,S
638,0,2,Mr. Hans Peder Jensen,male,31,1,1,C.A. 31921,26.25,,S
639,0,3,Mlle. Emma Sagesser,female,41,0,5,3101295,39.6875,,S
640,0,3,Miss. Margit Elizabeth Skoog,male,,1,0,376564,16.1,,S
641,0,3,Mr. Choong Foo,male,20,0,0,350050,7.8542,,S
642,1,1,Miss. Eugenie Baclini,female,24,0,0,PC 17477,69.3,B35,C
643,0,3,Mr. Henry Sleeper Harper,female,2,3,2,347088,27.9,,S
644,1,3,Mr. Liudevit Cor,male,,0,0,1601,56.4958,,S
645,1,3,Col. Oberst Alfons Simonius-Blumer,female,0.75,2,1,2666,19.2583,,C
646,1,1,Mr. Edward Willey,male,48,1,0,PC 17572,76.7292,D33,C
647,0,3,Miss. Amy Zillah Elsie Stanley,male,19,0,0,349231,7.8958,,S
648,1,1,Mr. Mito Mitkoff,male,56,0,0,13213,35.5,A26,C
649,0,3,Miss. Elsie Doling,male,,0,0,S.O./P.P. 751,7.55,,S
650,1,3,Mr. Johannes Halvorsen Kalvik,female,23,0,0,CA. 2314,7.55,,S
651,0,3,Miss. Hanora O'Leary,male,,0,0,349221,7.8958,,S
652,1,2,Miss. Hanora Hegarty,female,18,0,1,231919,23,,S
653,0,3,Mr. Leonard Mark Hickman,male,21,0,0,8475,8.4333,,S
654,1,3,Mr. Alexander Radeff,female,,0,0,330919,7.8292,,Q
655,0,3,Mrs. John (Catherine) Bourke,female,18,0,0,365226,6.75,,Q
656,0,2,Mr. George Floyd Eitemiller,male,24,2,0,S.O.C. 14879,73.5,,S
657,0,3,Mr. Arthur Webster Newell,male,,0,0,349223,7.8958,,S
658,0,3,Dr. Henry William Frauenthal,female,32,1,1,364849,15.5,,Q
659,0,2,Mr. Mohamed Badt,male,23,0,0,29751,13,,S
660,0,1,Mr. Edward Pomeroy Colley,male,58,0,2,35273,113.275,D48,C
661,1,1,Mr. Peju Coleff,male,50,2,0,PC 17611,133.65,,S
662,0,3,Mr. Eino William Lindqvist,male,40,0,0,2623,7.225,,C
663,0,1,Mr. Lewis Hickman,male,47,0,0,5727,25.5875,E58,S
664,0,3,Mr. Reginald Fenton Butler,male,36,0,0,349210,7.4958,,S
665,1,3,Mr. Knud Paust Rommetvedt,male,20,1,0,STON/O 2. 3101285,7.925,,S
666,0,2,Mr. Jacob Cook,male,32,2,0,S.O.C. 14879,73.5,,S
667,0,2,Mrs. Elmer Zebley (Juliet Cummins Wright) Taylor,male,25,0,0,234686,13,,S
668,0,3,Mrs. Thomas William Solomon (Elizabeth Catherine Ford) Brown,male,,0,0,312993,7.775,,S
669,0,3,Mr. Thornton Davidson,male,43,0,0,A/5 3536,8.05,,S
670,1,1,Mr. Henry Michael Mitchell,female,,1,0,19996,52,C126,S
671,1,2,Mr. Charles Wilhelms,female,40,1,1,29750,39,,S
672,0,1,Mr. Ennis Hastings Watson,male,31,1,0,F.C. 12750,52,B71,S
673,0,2,Mr. Gustaf Hjalmar Edvardsson,male,70,0,0,C.A. 24580,10.5,,S
674,1,2,Mr. Frederick Charles Sawyer,male,31,0,0,244270,13,,S
675,0,2,Miss. Anna Sofia Turja,male,,0,0,239856,0,,S
676,0,3,Mrs. Frederick (Augusta Tyler) Goodwin,male,18,0,0,349912,7.775,,S
677,0,3,Mr. Thomas Drake Martinez Cardeza,male,24.5,0,0,342826,8.05,,S
678,1,3,Miss. Katie Peters,female,18,0,0,4138,9.8417,,S
679,0,3,Mr. Hammad Hassab,female,43,1,6,CA 2144,46.9,,S
680,1,1,Mr. Thor Anderson Olsvigen,male,36,0,1,PC 17755,512.3292,B51 B53 B55,C
681,0,3,Mr. Charles Edward Goodwin,female,,0,0,330935,8.1375,,Q
682,1,1,Mr. Thomas William Solomon Brown,male,27,0,0,PC 17572,76.7292,D49,C
683,0,3,Mr. Joseph Philippe Lemercier Laroche,male,20,0,0,6563,9.225,,S
684,0,3,Mr. Jaako Arnold Panula,male,14,5,2,CA 2144,46.9,,S
685,0,2,Mr. Branko Dakic,male,60,1,1,29750,39,,S
686,0,2,Mr. Eberhard Thelander Fischer,male,25,1,2,SC/Paris 2123,41.5792,,C
687,0,3,Miss. Georgette Alexandra Madill,male,14,4,1,3101295,39.6875,,S
688,0,3,Mr. Albert Adrian Dick,male,19,0,0,349228,10.1708,,S
689,0,3,Miss. Manca Karun,male,18,0,0,350036,7.7958,,S
690,1,1,Mr. Ali Lam,female,15,0,1,24160,211.3375,B5,S
691,1,1,Mr. Khalil Saad,male,31,1,0,17474,57,B20,S
692,1,3,Col. John Weir,female,4,0,1,349256,13.4167,,C
693,1,3,Mr. Charles Henry Chapman,male,,0,0,1601,56.4958,,S
694,0,3,Mr. James Kelly,male,25,0,0,2672,7.225,,C
695,0,1,Miss. Katherine Mullens,male,60,0,0,113800,26.55,,S
696,0,2,Mr. John Borland Thayer,male,52,0,0,248731,13.5,,S
697,0,3,Mr. Adolf Mathias Nicolai Olsen Humblen,male,44,0,0,363592,8.05,,S
698,1,3,Mrs. John Jacob (Madeleine Talmadge Force) Astor,female,,0,0,35852,7.7333,,Q
699,0,1,Mr. Spencer Victor Silverthorne,male,49,1,1,17421,110.8833,C68,C
700,0,3,Miss. Saiide Barbara,male,42,0,0,348121,7.65,F G63,S
701,1,1,Mr. Martin Gallagher,female,18,1,0,PC 17757,227.525,C62 C64,C
702,1,1,Mr. Henrik Juul Hansen,male,35,0,0,PC 17475,26.2875,E24,S
703,0,3,Mr. Henry Samuel Morley,female,18,0,1,2691,14.4542,,C
704,0,3,Mrs. Florence Kelly,male,25,0,0,36864,7.7417,,Q
705,0,3,Mr. Edward Pennington Calderhead,male,26,1,0,350025,7.8542,,S
706,0,2,Miss. Alice Cleaver,male,39,0,0,250655,26,,S
707,1,2,Master. Halim Gonios Moubarek,female,45,0,0,223596,13.5,,S
708,1,1,Mlle. Berthe Antonine Mayne,male,42,0,0,PC 17476,26.2875,E24,S
709,1,1,Mr. Herman Klaber,female,22,0,0,113781,151.55,,S
710,1,3,Mr. Elmer Zebley Taylor,male,,1,1,2661,15.2458,,C
711,1,1,Mr. August Viktor Larsson,female,24,0,0,PC 17482,49.5042,C90,C
712,0,1,Mr. Samuel Greenberg,male,,0,0,113028,26.55,C124,S
713,1,1,Mr. Peter Andreas Lauritz Andersen Soholt,male,48,1,0,19996,52,C126,S
714,0,3,Miss. Caroline Louise Endres,male,29,0,0,7545,9.4833,,S
715,0,2,Miss. Edwina Celia Troutt,male,52,0,0,250647,13,,S
716,0,3,Mr. Malkolm Joackim Johnson,male,19,0,0,348124,7.65,F G73,S
717,1,1,Miss. Annie Jessie Harper,female,38,0,0,PC 17757,227.525,C45,C
718,1,2,Mr. Svend Lauritz Jensen,female,27,0,0,34218,10.5,E101,S
719,0,3,Mr. William Henry Gillespie,male,,0,0,36568,15.5,,Q
720,0,3,Mr. Henry Price Hodges,male,33,0,0,347062,7.775,,S
721,1,2,Mr. Norman Campbell Chambers,female,6,0,1,248727,33,,S
722,0,3,Mr. Luka Oreskovic,male,17,1,0,350048,7.0542,,S
723,0,2,Mrs. Peter Henry (Lillian Jefferys) Renouf,male,34,0,0,12233,13,,S
724,0,2,Miss. Margareth Mannion,male,50,0,0,250643,13,,S
725,1,1,Mr. Kurt Arnold Gottfrid Bryhl,male,27,1,0,113806,53.1,E8,S
726,0,3,Miss. Pieta Sofia Ilmakangas,male,20,0,0,315094,8.6625,,S
727,1,2,Miss. Elisabeth Walton Allen,female,30,3,0,31027,21,,S
728,1,3,Mr. Houssein G N Hassan,female,,0,0,36866,7.7375,,Q
729,0,2,Mr. Robert J Knight,male,25,1,0,236853,26,,S
730,0,3,Mr. William John Berriman,female,25,1,0,STON/O2. 3101271,7.925,,S
731,1,1,Mr. Moses Aaron Troupiansky,female,29,0,0,24160,211.3375,B5,S
732,0,3,Mr. Leslie Williams,male,11,0,0,2699,18.7875,,C
733,0,2,Mrs. Edward (Margaret Ann Watson) Ford,male,,0,0,239855,0,,S
734,0,2,Mr. Gustave J Lesurer,male,23,0,0,28425,13,,S
735,0,2,Mr. Kanio Ivanoff,male,23,0,0,233639,13,,S
736,0,3,Mr. Minko Nankoff,male,28.5,0,0,54636,16.1,,S
737,0,3,Mr. Walter James Hawksford,female,48,1,3,W./C. 6608,34.375,,S
738,1,1,Mr. Tyrell William Cavendish,male,35,0,0,PC 17755,512.3292,B101,C
739,0,3,Miss. Susan Parker Ryerson,male,,0,0,349201,7.8958,,S
740,0,3,Mr. Neal McNamee,male,,0,0,349218,7.8958,,S
741,1,1,Mr. Juho Stranden,male,,0,0,16988,30,D45,S
742,0,1,Capt. Edward Gifford Crosby,male,36,1,0,19877,78.85,C46,S
743,1,1,Mr. Rossmore Edward Abbott,female,21,2,2,PC 17608,262.375,B57 B59 B63 B66,C
744,0,3,Miss. Anna Sinkkonen,male,24,1,0,376566,16.1,,S
745,1,3,Mr. Daniel Warner Marvin,male,31,0,0,STON/O 2. 3101288,7.925,,S
746,0,1,Mr. Michael Connaghton,male,70,1,1,WE/P 5735,71,B22,S
747,0,3,Miss. Joan Wells,male,16,1,1,C.A. 2673,20.25,,S
748,1,2,Master. Meier Moor,female,30,0,0,250648,13,,S
749,0,1,Mr. Johannes Joseph Vande Velde,male,19,1,0,113773,53.1,D30,S
750,0,3,Mr. Lalio Jonkoff,male,31,0,0,335097,7.75,,Q
751,1,2,Mrs. Samuel (Jane Laver) Herman,female,4,1,1,29103,23,,S
752,1,3,Master. Viljo Hamalainen,male,6,0,1,392096,12.475,E121,S
753,0,3,Mr. August Sigfrid Carlsson,male,33,0,0,345780,9.5,,S
754,0,3,Mr. Percy Andrew Bailey,male,23,0,0,349204,7.8958,,S
755,1,2,Mr. Thomas Leonard Theobald,female,48,1,2,220845,65,,S
756,1,2,the Countess. of (Lucy Noel Martha Dyer-Edwards) Rothes,male,0.67,1,1,250649,14.5,,S
757,0,3,Mr. John Garfirth,male,28,0,0,350042,7.7958,,S
758,0,2,Mr. Iisakki Antino Aijo Nirva,male,18,0,0,29108,11.5,,S
759,0,3,Mr. Hanna Assi Barah,male,34,0,0,363294,8.05,,S
760,1,1,Mrs. William Ernest (Lucile Polk) Carter,female,33,0,0,110152,86.5,B77,S
761,0,3,Mr. Hans Linus Eklund,male,,0,0,358585,14.5,,S
762,0,3,Mrs. John C (Anna Andrews) Hogeboom,male,41,0,0,SOTON/O2 3101272,7.125,,S
763,1,3,Dr. Arthur Jackson Brewe,male,20,0,0,2663,7.2292,,C
764,1,1,Miss. Mary Mangan,female,36,1,2,113760,120,B96 B98,S
765,0,3,Mr. Daniel J Moran,male,16,0,0,347074,7.775,,S
766,1,1,Mr. Daniel Danielsen Gronnestad,female,51,1,0,13502,77.9583,D11,S
767,0,1,Mr. Rene Aime Lievens,male,,0,0,112379,39.6,,C
768,0,3,Mr. Niels Peder Jensen,female,30.5,0,0,364850,7.75,,Q
769,0,3,Mrs. (Mary) Mack,male,,1,0,371110,24.15,,Q
770,0,3,Mr. Dibo Elias,male,32,0,0,8471,8.3625,,S
771,0,3,Mrs. Elizabeth (Eliza Needs) Hocking,male,24,0,0,345781,9.5,,S
772,0,3,Mr. Pehr Fabian Oliver Malkolm Myhrman,male,48,0,0,350047,7.8542,,S
773,0,2,Mr. Roger Tobin,female,57,0,0,S.O./P.P. 3,10.5,E77,S
774,0,3,Miss. Virginia Ethel Emanuel,male,,0,0,2674,7.225,,C
775,1,2,Mr. Thomas J Kilgannon,female,54,1,3,29105,23,,S
776,0,3,Mrs. Edward Scott (Elisabeth Walton McMillan) Robert,male,18,0,0,347078,7.75,,S
777,0,3,Miss. Banoura Ayoub,male,,0,0,383121,7.75,F38,Q
778,1,3,Mrs. Albert Adrian (Vera Gillespie) Dick,female,5,0,0,364516,12.475,,S
779,0,3,Mr. Milton Clyde Long,male,,0,0,36865,7.7375,,Q
780,1,1,Mr. Andrew G Johnston,female,43,0,1,24160,211.3375,B3,S
781,1,3,Mr. William Ali,female,13,0,0,2687,7.2292,,C
782,1,1,Mr. Abraham (David Lishin) Harmer,female,17,1,0,17474,57,B20,S
783,0,1,Miss. Anna Sofia Sjoblom,male,29,0,0,113501,30,D6,S
784,0,3,Master. George Hugh Rice,male,,1,2,W./C. 6607,23.45,,S
785,0,3,Master. Bertram Vere Dean,male,25,0,0,SOTON/O.Q. 3101312,7.05,,S
786,0,3,Mr. Benjamin Guggenheim,male,25,0,0,374887,7.25,,S
787,1,3,Mr. Andrew Keane,female,18,0,0,3101265,7.4958,,S
788,0,3,Mr. Alfred Gaskell,male,8,4,1,382652,29.125,,Q
789,1,3,Miss. Stella Anna Sage,male,1,1,2,C.A. 2315,20.575,,S
790,0,1,Mr. William Fisher Hoyt,male,46,0,0,PC 17593,79.2,B82 B84,C
791,0,3,Mr. Ristiu Dantcheff,male,,0,0,12460,7.75,,Q
792,0,2,Mr. Richard Otter,male,16,0,0,239865,26,,S
793,0,3,Dr. Alice (Farnham) Leader,female,,8,2,CA. 2343,69.55,,S
794,0,1,Mrs. Mara Osman,male,,0,0,PC 17600,30.6958,,C
795,0,3,Mr. Yousseff Ibrahim Shawah,male,25,0,0,349203,7.8958,,S
796,0,2,Mrs. Jean Baptiste (Rosalie Paula Govaert) Van Impe,male,39,0,0,28213,13,,S
797,1,1,Mr. Martin Ponesell,female,49,0,0,17465,25.9292,D17,S
798,1,3,Mrs. Harvey (Charlotte Annie Tate) Collyer,female,31,0,0,349244,8.6833,,S
799,0,3,Master. William Thornton II Carter,male,30,0,0,2685,7.2292,,C
800,0,3,Master. Assad Alexander Thomas,female,30,1,1,345773,24.15,,S
801,0,2,Mr. Oskar Arvid Hedman,male,34,0,0,250647,13,,S
802,1,2,Mr. Karl Johan Johansson,female,31,1,1,C.A. 31921,26.25,,S
803,1,1,Mr. Thomas Jr Andrews,male,11,1,2,113760,120,B96 B98,S
804,1,3,Miss. Ellen Natalia Pettersson,male,0.42,0,1,2625,8.5167,,C
805,1,3,Mr. August Meyer,male,27,0,0,347089,6.975,,S
806,0,3,Mrs. Norman Campbell (Bertha Griggs) Chambers,male,31,0,0,347063,7.775,,S
807,0,1,Mr. William Alexander,male,39,0,0,112050,0,A36,S
808,0,3,Mr. James Lester,female,18,0,0,347087,7.775,,S
809,0,2,Mr. Richard James Slemen,male,39,0,0,248723,13,,S
810,1,1,Miss. Ebba Iris Alfrida Andersson,female,33,1,0,113806,53.1,E8,S
811,0,3,Mr. Ernest Portage Tomlin,male,26,0,0,3474,7.8875,,S
812,0,3,Mr. Richard Fry,male,39,0,0,A/4 48871,24.15,,S
