PassengerId,Survived,Pclass,Name,Sex,Age,SibSp,Parch,Ticket,Fare,Cabin,Embarked
813,0,2,Miss. Wendla Maria Heininen,male,35,0,0,28206,10.5,,S
814,0,3,Mr. Albert Mallet,female,6,4,2,347082,31.275,,S
815,0,3,Mr. John Fredrik Alexander Holm,male,30.5,0,0,364499,8.05,,S
816,0,1,Master. Karl Thorsten Skoog,male,,0,0,112058,0,B102,S
817,0,3,Mrs. Charles Melville (Clara Jennings Gregg) Hays,female,23,0,0,STON/O2. 3101290,7.925,,S
818,0,2,Mr. Nikola Lulic,male,31,1,1,S.C./PARIS 2079,37.0042,,C
819,0,3,Jonkheer. John George Reuchlin,male,43,0,0,C 7075,6.45,,S
820,0,3,Mrs. (Beila) Moor,male,10,3,2,347088,27.9,,S
821,1,1,Master. Urho Abraham Panula,female,52,1,1,12749,93.5,B69,S
822,1,3,Mr. John Flynn,male,27,0,0,315098,8.6625,,S
823,0,1,Mr. Len Lam,male,38,0,0,19972,0,,S
824,1,3,Master. Andre Mallet,female,27,0,1,392096,12.475,E121,S
825,0,3,Mr. Thomas Joseph McCormack,male,2,4,1,3101295,39.6875,,S
826,0,3,Mrs. George Nelson (Martha Evelyn) Stone,male,,0,0,368323,6.95,,Q
827,0,3,Mrs. Antoni (Selini Alexander) Yasbeck,male,,0,0,1601,56.4958,,S
828,1,2,Master. George Sibley Richards,male,1,0,2,S.C./PARIS 2079,37.0042,,C
829,1,3,Mr. Amin Saad,male,,0,0,367228,7.75,,Q
830,1,1,Mr. Albert Augustsson,female,62,0,0,113572,80,B28,
831,1,3,Mr. Owen George Allum,female,15,1,0,2659,14.4542,,C
832,1,2,Miss. Sara Rebecca Compton,male,0.83,1,1,29106,18.75,,S
833,0,3,Mr. Jakob Pasic,male,,0,0,2671,7.2292,,C
834,0,3,Mr. Maurice Sirota,male,23,0,0,347468,7.8542,,S
835,0,3,Mr. Chang Chip,male,18,0,0,2223,8.3,,S
836,1,1,Mr. Pierre Marechal,female,39,1,1,PC 17756,83.1583,E49,C
837,0,3,Mr. Ilmari Rudolf Alhomaki,male,21,0,0,315097,8.6625,,S
838,0,3,Mr. Thomas Charles Mudd,male,,0,0,392092,8.05,,S
839,1,3,Miss. Augusta Serepeca,male,32,0,0,1601,56.4958,,S
840,1,1,Mr. Peter L Lemberopolous,male,,0,0,11774,29.7,C47,C
841,0,3,Mr. Jeso Culumovic,male,20,0,0,SOTON/O2 3101287,7.925,,S
842,0,2,Mr. Anthony Abbing,male,16,0,0,S.O./P.P. 3,10.5,,S
843,1,1,Mr. Douglas Bullen Sage,female,30,0,0,113798,31,,C
844,0,3,Mr. Marin Markoff,male,34.5,0,0,2683,6.4375,,C
845,0,3,Rev. John Harper,male,17,0,0,315090,8.6625,,S
846,0,3,Mrs. Samuel L (Edwiga Grabowska) Goldenberg,male,42,0,0,C.A. 5547,7.55,,S
847,0,3,Master. Sigvard Harald Elias Andersson,male,,8,2,CA. 2343,69.55,,S
848,0,3,Mr. Johan Svensson,male,35,0,0,349213,7.8958,,C
849,0,2,Miss. Nourelain Boulos,male,28,0,1,248727,33,,S
850,1,1,Miss. Mary Conover Lines,female,,1,0,17453,89.1042,C92,C
851,0,3,Mrs. Ernest Courtenay (Lilian Hughes) Carter,male,4,4,2,347082,31.275,,S
852,0,3,Mrs. Sam (Leah Rosen) Aks,male,74,0,0,347060,7.775,,S
853,0,3,Mrs. George Dennick (Mary Hitchcock) Wick,female,9,1,1,2678,15.2458,,C
854,1,1,Mr. Peter Denis Daly,female,16,0,1,PC 17592,39.4,D28,S
855,0,2,Mrs. Solomon (Latifa Qurban) Baclini,female,44,1,0,244252,26,,S
856,1,3,Mr. Raihed Razi,female,18,0,1,392091,9.35,,S
857,1,1,Mr. Claus Peter Hansen,female,45,1,1,36928,164.8667,,S
858,1,1,Mr. Frederick Edward Giles,male,51,0,0,113055,26.55,E17,S
859,1,3,Mrs. Frederick Joel (Margaret Welles Barron) Swift,female,24,0,3,2666,19.2583,,C
860,0,3,Miss. Dorothy Edith Sage,male,,0,0,2629,7.2292,,C
861,0,3,Mr. John William Gill,male,41,2,0,350026,14.1083,,S
862,0,2,Mrs. (Karolina) Bystrom,male,21,1,0,28134,11.5,,S
863,1,1,Miss. Asuncion Duran y More,female,48,0,0,17466,25.9292,D17,S
864,0,3,Mr. Washington Augustus II Roebling,female,,8,2,CA. 2343,69.55,,S
865,0,2,Mr. Philemon van Melkebeke,male,24,0,0,233866,13,,S
866,1,2,Master. Harold Theodor Johnson,female,42,0,0,236852,13,,S
867,1,2,Mr. Cerin Balkic,female,27,1,0,SC/PARIS 2149,13.8583,,C
868,0,1,Mrs. Richard Leonard (Sallie Monypeny) Beckwith,male,31,0,0,PC 17590,50.4958,A24,S
869,0,3,Mr. Frans Olof Carlsson,male,,0,0,345777,9.5,,S
870,1,3,Mr. Victor Vander Cruyssen,male,4,1,1,347742,11.1333,,S
871,0,3,Mrs. Samuel (Hannah Wizosky) Abelson,male,26,0,0,349248,7.8958,,S
872,1,1,Miss. Adele Kiamie Najib,female,47,1,1,11751,52.5542,D35,S
873,0,1,Mr. Alfred Ossian Gustafsson,male,33,0,0,695,5,B51 B53 B55,S
874,0,3,Mr. Nedelio Petroff,male,47,0,0,345765,9,,S
875,1,2,Mr. Kristo Laleff,female,28,1,0,P/PP 3381,24,,C
876,1,3,Mrs. Thomas Jr (Lily Alexenia Wilson) Potter,female,15,0,0,2667,7.225,,C
877,0,3,Mrs. William (Imanita Parrish Hall) Shelley,male,20,0,0,7534,9.8458,,S
878,0,3,Mr. Johann Markun,male,19,0,0,349212,7.8958,,S
879,0,3,Miss. Gerda Ulrika Dahlberg,male,,0,0,349217,7.8958,,S
880,1,1,Mr. Frederick James Banfield,female,56,0,1,11767,83.1583,C50,C
881,1,2,Mr. Henry Jr Sutehall,female,25,0,1,230433,26,,S
882,0,3,Mrs. William (Margaret Norton) Rice,male,33,0,0,349257,7.8958,,S
883,0,3,Rev. Juozas Montvila,female,22,0,0,7552,10.5167,,S
884,0,2,Miss. Margaret Edith Graham,male,28,0,0,C.A./SOTON 34068,10.5,,S
885,0,3,Miss. Catherine Helen Johnston,male,25,0,0,SOTON/OQ 392076,7.05,,S
886,0,3,Mr. Karl Howell Behr,female,39,0,5,382652,29.125,,Q
887,0,2,Mr. Patrick Dooley,male,27,0,0,211536,13,,S
888,1,1,,female,19,0,0,112053,30,B42,S
889,0,3,,female,,1,2,W./C. 6607,23.45,,S
890,1,1,,male,26,0,0,111369,30,C148,C
891,0,3,,male,32,0,0,370376,7.75,,Q
